US	399143	4CEPA-FASTNET 4-County Electric Power Association
US	30067	AACG-AS Anne Arundel County Govt
IN	133725	AAIIT-AS AIRPORTS AUTHORITY OF INDIA
US	10944	ABAG-10944 Association of Bay Area Governments
AU	9342	ABCNET-AS-AP Australian Broadcasting Commission
US	19150	ABCWUA-ASN Albuquerque Bernalillo County Water Utility Authority
US	62600	ABOR-SUN-CORRIDOR Arizona Board of Regents
AU	9983	ABS-AS-AP Australian Bureau of Statistics.
US	14707	ABSHOU-ASN American Bureau of Shipping
US	394435	ACLIBRARY Alameda County Library
US	53825	ACMC-AS ALAMEDA COUNTY MEDICAL CENTER
US	25629	ACPS-8-ASN Albemarle County Public Schools
AU	132909	ACTGOV-AS-AP ACT Government InTACT Group
AU	139344	ACTGOV-EDU-AS-AP ACT Government InTACT Group
US	395302	ADAMS-COUNTY-COLORADO Adams County, Colorado
US	11577	ADS-ASN Vermont Department of Information and Innovation
US	30392	ADVISORY The Advisory Board Company
LV	198138	AGENCY77
AL	42409	AKEP-AS Electronic and Postal Communications Authority - AKEP
US	53638	ALACHUA-COUNTY-BOCC Alachua County BOCC
BR	266411	ALAGOAS TRIBUNAL DE CONTAS DO ESTADO DE ALAGOAS
US	12054	ALAMEDACOUNTYDATAPROCESSING Alameda County
US	397908	ALDOT-ROUTE Alabama Department of Transportation
US	54559	ALGH-DCS COUNTY OF ALLEGHENY
US	15350	ALGN-ASN-001 Algona Municipal Utilities
BR	263639	AMAZONAS TRIBUNAL DE JUSTICA
US	397332	ANACORTES-MUNICIPAL-ISP City of Anacortes
US	31859	ANGELINA-COUNTY ANGELINA COUNTY
CN	58448	AP-CONAC-AS-AP CONAC China Organizational Name Administration Center
CN	58536	AP-CONAC-AS-AP CONAC China Organizational Name Administration Center
CN	58811	AP-CONAC-AS-AP CONAC China Organizational Name Administration Center
US	27403	APA-CTY Apache County Schools Superintendents Office
KR	9270	APAN-KR-AS National Infomation Society Agency
IN	137671	APITEC-AS-IN ITE&C DEPARTMENT, GOVERNMENT OF A.P.
KR	38418	APPLYHOME-AS-KR KOREA APPRAISAL BOARD
RU	59571	APPSMINISTRY-AS
US	398192	ARDOT-NET-01 Arkansas Department of Transportation
US	25807	ARLINGTONVA Arlington County Government
US	53457	ARROWHEADGENERAL-SD1 Arrowhead General Insurance Agency
US	398277	AS Miller Advertising Agency Inc.
US	21963	AS-AGENCYINSURANCEMD-0001 Agency Insurance Company
VG	14694	AS-BVIX Telecommunications Regulatory Commission
US	18815	AS-CITY-AND-COUNTY-OF-DENVER CITY AND COUNTY OF DENVER
US	14645	AS-CJIS-20 CJIS-Consortium-20th-Court Administration
CA	53437	AS-CSBE Commission scolaire de la Beauce-Etchemin
CA	53319	AS-CSDP Commission scolaire des Phares
CA	54783	AS-CSDUROY Commission scolaire du Chemin-du-Roy
CA	13942	AS-CSMV Commission Scolaire Marie-Victorin
US	12155	AS-HMPL Henderson Municipal Power & Light
CA	397711	AS-HRPS Halton Regional Police Service
CA	397667	AS-HWDSB Hamilton-Wentworth District School Board
US	396910	AS-LCPA-14 Lee County Port Authority
US	62983	AS-MPA The Massachusetts Port Authority
US	33138	AS-NYPD New York City Police Department
US	40116	AS-NYSDI New York State Department of Financial Services
US	393876	AS-PMGAA Phoenix-Mesa Gateway Airport Authority
CA	17353	AS-SCDSB Simcoe County District School Board
US	396220	AS-SNOPUD Public Utility District No. 1 of Snohomish County
US	23228	AS1-CO-EL-PASO-TX The County of El Paso
US	10343	AS10343 National Aeronautics and Space Administration
US	11833	AS11833-LEAPFROG-INTERACTIVE LEAP Agency LLC
US	1701	AS1701 National Aeronautics and Space Administration
US	1843	AS1843-7 National Aeronautics and Space Administration
US	1848	AS1848 National Aeronautics and Space Administration
US	2143	AS2143 National Aeronautics and Space Administration
US	22284	AS22284-DOI-OPS Bureau of Land Management Joint Pipeline Office
US	22767	AS22767 National Aeronautics and Space Administration
US	24	AS24 National Aeronautics and Space Administration
US	270	AS270 National Aeronautics and Space Administration
US	297	AS297 National Aeronautics and Space Administration
US	33354	AS33354 PORT AUTHORITY OF New York and New Jersey
US	372	AS372 National Aeronautics and Space Administration
US	393547	AS393547 San Diego County Credit Union
US	394633	ASCENSION-MINISTRYSERVICECENTER Ascension Technologies
GE	209332	ASCOURT
PH	59243	ASI-PH 3rd Floor, Kings Court 1, Chino Roces Avenue
AU	138681	ASIC-AS-AP AUSTRALIAN SECURITIES & INVESTMENTS COMMISSION ASIC
US	19074	ASN-01-FBCL Fort Bend County Libraries
US	40451	ASN-BOP Board of Pensions of the Evangelical Lutheran Church in America
US	20407	ASN-FBMC-WDM-IA Farm Bureau Management Corporation
US	46830	ASN-GWINNETT Gwinnett County Public Schools
US	40413	ASN-HCMC Hennepin County Medical Center
VA	8978	ASN-HOLYSEE Holy See Secretariat of State Department of Telecommunications
US	11985	ASN-SSA Social Security Administration
US	26869	ASN-STPSB ST. TAMMANY PARISH SCHOOL BOARD
US	397793	ASN-SWBNO-01 Sewerage and Water Board of New Orleans
US	33444	ASN-TAZEWELL-CO-VA-GOVT Tazewell County
US	33116	ASN-WASH-CO-VA-SCHOOLS Washington County Schools
US	4900	ASN1 Montgomery County Hospital District
AS	9751	ASTCA-AS-AP AMERICAN SAMOA TELECOMMUNICATIONS AUTHORITY
AT	43913	AT-AGES-AS Austrian Agency for Health and Food Safety
US	22842	ATT-L3 Butler County Community College
US	395777	AUBFIBER ATHENS UTILITIES BOARD
NZ	135288	AUCKLANDMUSEUM-AS-AP Auckland Museum Trust Board
AU	17987	AUDA-AU-AS .au Domain Administration
AU	38332	AUDA-AU-AS .au Domain Administration Ltd
AU	38076	AUST-SPORT-COMMISION-AU-AP Australian Sports Commission. Bruce, ACT
AU	17928	AWTA-AS-AU-AP Australian Wool Testing Authority Ltd
RU	8506	Academy of Irkutsk Scientific Centre of Siberian Department of RAN
US	13351	B-U-C Barbourville Utility Commission
US	6099	BAE-NET-ASN Alameda County Office of Education
US	30102	BALDWIN Baldwin County Commission
US	53302	BALTIMORECOUNTYGOVERNMENT Baltimore County Government
AR	270105	BANCO MUNICIPAL DE ROSARIO
BD	133477	BANGLADESHPOLICE-AS-AP Bangladesh Police
US	1430	BB0-BOSTON Board of Bar Overseers
BD	55846	BBN-AS-AP IMED, Ministry of Planning, Government of the Peoples Republic of Bangladesh
US	16627	BCCA-AS Board of Commissioners of the County of Allen
US	400376	BCCC Bay County Clerk of Court & Comptroller
US	19395	BCCC-COLLEGE-I2 Bucks County Community College
US	54547	BCCLS-AS Bergen County Cooperative Library System
US	397271	BCG Blount County Government
US	39990	BCG Boulder County Government
US	395346	BCI-AS-1 Bonneville County Idaho
US	22391	BCIS-BEXAR-COUNTY-INFORMATION-SERVICES Bexar County -  Information Services
US	31763	BCIU Berks County Intermediate Unit
US	16958	BCIU-22 Bucks County Intermediate Unit #22
US	32430	BCPO Bergen County Prosecutors Office
US	63481	BCRH BAXTER COUNTY REGIONAL HOSPITAL, INC
BD	139236	BDLGED-AS-AP Local Government Engineering Department LGED
KR	131098	BDNSKR-AS-KR Korea Internet Security Agency
US	3635	BEA US Department of Commerce, Bureau of Economic Analysis
US	32253	BECPL Buffalo & Erie County Public Library
US	394488	BERGEN-COUNTY-SCHOOL-DISTRICT Bergen County Vocational Technical School District
US	1983	BERNALILLO Bernalillo County
US	26244	BGMU Bowling Green Municipal Utilities
US	22920	BIAEDNET-INTERNET Bureau of Indian Affairs Office of IndianEducation
US	13378	BIB-INET BACKGROUND INVESTIGATION BUREAU INC
VN	140768	BINHDINH-AS-VN Binh Dinh Department of Information and Communications
US	399849	BIZZARROAGENCY BIZZARRO AGENCY LLC
US	397281	BJCCA-1 Birmingham Jefferson Civic Center Authority
HU	25171	BKAENET-AS Budapest University of Economic Sciences and Public Administration
US	22556	BLACKBOARD Blackboard Inc.
US	398169	BLACKBOARD Blackboard
BM	47060	BMA Bermuda Monetary Authority
TH	17478	BMA-AS-AP Bangkok Metropolitan Administration
CN	139122	BMAC BEIJING MUNICIPAL ADMINISTRATION COMMUNICATION CARD CO..LTD
AT	47515	BMI-GOVIX
US	22422	BOARD-OF-ELECTIONS-IN-THE-CITY-OF-NEW-YORK Board of Elections in the City of New York
US	22620	BOARDPENSIONS-PRESBYTERIAN The Board of Pensions of the Presbyterian Church (USA)
US	22601	BONNPOWERNET Bonneville Power Administration
VN	131369	BONONGNGHIEP-AS-VN Ministry of Agriculture and Rural Development
US	11361	BOSCOVS Boscov's Department Store, LLC
BD	142159	BPATC-AS-AP Bangladesh Public Administration Training Centre
IN	45851	BPCL-007-IN Bharat Bhawan - II, IIS Department
US	395202	BRADFORD-COUNTY-FLORIDA Bradford County Board of County Commissioners
US	55087	BRAZOS-ASN-1 Brazos County
KR	9320	BREGISTRY-AS-KR Supreme Court of Korea
US	393986	BRIGHTRIDGE-1945 Johnson City Power Board
US	32057	BRMHMRB BLUEGRASS REGIONAL MENTAL HEALTH-MENTAL RETARDATION BOARD, INC.
US	395006	BROOMFIELD-COLORADO The City and County of Broomfield
US	30187	BROWARD-COUNTY-COMMISION Broward County Commission
US	22718	BROWNSVILLE-PUBLIC-UTILITIES-BOARD Brownsville Public Utilities Board
BD	136901	BTRC-AS-AP Bangladesh Telecommunication Regulatory Commission BTRC
US	21713	BULLOCH Bulloch County Rural Telephone Cooperative, Inc.
US	10655	BUREAU-NAT-AFF BUREAU OF NATIONAL AFFAIRS, INC.
AU	23667	BUREAU-OF-METEOROLOGY-AP Commonwealth Bureau of Meteorology
PH	140722	BUREAUOFTHETREASURY-AS-AP Bureau of the Treasury
US	62944	BURTON-BURLINGTON Burton Snowboards
BD	139296	BWDB-AS-AP Bangladesh Water Development Board
CA	1634	BWDSB Bluewater District School Board
US	53901	BWS-DR-IX-AS Board of Water Supply
US	46520	CA-DOJ California Department of Justice
US	1348	CA-DOTNET-AS California Department of Transportation
MN	137511	CAAM-AS-AP Civil Aviation Authority of Mongolia
US	2894	CALIF-DWR California Department of Water Resources
US	14262	CALUMET-ASN-01 CALUMET COUNTY
US	55111	CALVERT-COUNTY Calvert County
US	30227	CAMBRIDGE-HEALTH-ALLIANCE Cambridge Public Health Commission
KR	45999	CAR Korea Transportation Safety Authority
US	4954	CARR Carroll County Government
US	29926	CARROLL-COUNTY-SCHOOLS Carroll County Board of Education
US	16956	CATTARAUGUS-COUNTY Cattaraugus County
CA	19220	CBE Calgary Board of Education
US	16919	CBNY College Entrance Examination Board
US	16760	CBOE Chicago Board Options Exchange
US	46825	CBPU Coldwater Board of Public Utilities
US	26839	CBS-FULTON CREDIT BUREAU SYSTEMS
US	23193	CCAC Community College of Allegheny County
US	54862	CCBC-MONACA Community College of Beaver County
US	396215	CCBCC-FL Charlotte County Board of County Commissioners
US	396201	CCCAS1 Contra Costa County
US	394763	CCCERA-AS Contra Costa County Employees Retirement Association
US	23309	CCCOE-NET Contra Costa County Office of Education
US	26963	CCCU-1 City & County Credit Union
US	399962	CCECA-1 Cherokee County Electric Cooperative Association
US	62488	CCG-AS Columbia County, Georgia
US	46744	CCHNL City and County of Honolulu
US	395939	CCHWYO-AS395939 Campbell County Health
US	54214	CCMH-AS1 Comanche County Memorial Hospital
US	19319	CCN-DMZ Bonneville Power Administration
US	36675	CCPS-1 Collier County Public Schools
US	63165	CCPS-17ASN Clayton County Public Schools
US	32897	CCPUD-NETWORKS Chelan County Public Utility District No.1
US	22164	CCSD Clark County School District
US	397498	CCSD-ASN Cherokee County School District
US	39961	CCSF San Francisco Department of Telecommunications and Information Services
CA	2653	CDAGOVN Shared Services Canada
CA	2665	CDAGOVN Shared Services Canada
CA	2675	CDAGOVN Shared Services Canada
CA	2680	CDAGOVN Shared Services Canada
CA	2682	CDAGOVN Shared Services Canada
CA	23307	CDE-NS Nova Scotia Department of Education
US	40749	CDELIGHTBAND CLARKSVILLE DEPARTMENT OF ELECTRICITY
KR	131099	CDNSKR-AS-KR Korea Internet Security Agency
US	25628	CDP Collier County Clerk of the Circuit Court
US	396912	CEICMHA Community Mental Health Authority of Clinton-Eaton-Ingham Counties
US	7764	CENSUSBUREAU U. S. Bureau of the Census
AU	18055	CENTRELINK Department of Human Services
AU	136774	CEWA-AS-AP Western Australian Electoral Commission
AU	46014	CFA-VIC-AS-AP Country Fire Authority
CN	58866	CFCA-NET China Financial Certification Authority
US	13855	CFU-NET The Municipal Communications Utility of the City of Cedar Falls, Iowa
TH	45533	CGD-AS-TH-AP Comptroller Generals Department
US	398864	CHAR-CO-FL-SB The School Board of Charlotte County, FL
US	397120	CHEMUNGCONY Chemung County, New York
US	395843	CHEROKEE-CO-GA-BOC Cherokee County Board of Commissioners
US	400218	CHEROKEE-NATION-GOV Cherokee Nation Government
US	54481	CHESCO204108252 County of Chester
US	11760	CHFA Connecticut Housing Finance Authority
US	21631	CHFA-COLORADO Colorado Housing and Finance Authority
US	40525	CHOC CHILDRENS HOSPITAL OF ORANGE COUNTY
US	27502	CHOWCHILLADIST Madera County Office of Education
US	396257	CHURCH-OF-THE-NAZARENE-INC General Board of The Church of The Nazarene
US	53532	CINNAMINSON-SCHOOLS The Board of Education of the Township of Cinnaminson
CA	396501	CIRA-5 CIRA Canadian Internet Registration Authority Autorit Canadienne pour les enregistrements Internet
CA	55195	CIRA-CLOUD1 CIRA Canadian Internet Registration Authority Autorit Canadienne pour les enregistrements Internet
CA	394354	CIRA-CLOUD2 CIRA Canadian Internet Registration Authority Autorit Canadienne pour les enregistrements Internet
CA	27299	CIRA-REGISTRY CIRA Canadian Internet Registration Authority Autorit Canadienne pour les enregistrements Internet
CA	40568	CIRADNS3 CIRA Canadian Internet Registration Authority Autorit Canadienne pour les enregistrements Internet
AU	9650	CITEC-AU-AP QLD Government Business IT
US	32579	CITY-OF-VALLEJO City of Vallejo, A municipal corporation
US	40743	CJPIA-ASN1 California Joint Powers Insurance Authority
US	18995	CLACKAMAS-ASN Clackamas County
US	40619	CLARK-COUNTY-NEVADA Clark County, Nevada
US	36612	CLARKCOUNTYWA Clark County WA
US	40710	CLC-98-ILLINOIS College of Lake County
US	398571	CLEVELAND-COUNTY-TEL-01 CLEVELAND COUNTY TELEPHONE CO. INC.
US	40252	CLEVELAND-MUNICIPAL-SCHOOL-DISTRICT Cleveland Municipal School District
BG	12564	CMBG-AS Bulgarian Government Autonomous System
US	23397	CME-VEN-AS23397 Chicago Board of Trade
US	394193	CMNJ-ASN County of Morris OIT
US	63324	CMTA-2 Capital Metropolitan Transportation Authority
US	393438	CMWD Calleguas Municipal Water District
US	399751	CNTYRCKHM County of Rockingham
US	393605	COGNET Brazos Valley Council of Governments
US	36739	COLLIER-COUNTY-GOVERNMENT-BCC Collier County Government
US	53662	COLLIER-COUNTY-SHERIFFS-OFFICE Collier County Sheriff's Office
US	395288	COLLIN-EDU Collin County Community College District
US	31756	COLORADOSPRINGS-GOV City of Colorado Springs
PK	7590	COMSATS Commission on Science and Technology for
BR	264469	CONSELHO DA JUSTICA FEDERAL
US	46286	COOK-COUNTY Cook County
US	399436	CORTLAND-COUNTY Cortland County Health Department
US	11901	COSWAN County of Sacramento
US	53369	COUNTY-OF-ALBEMARLE County of Albemarle
US	62971	COUNTY-OF-CHESTERFIELD-VA County of Chesterfield
US	26208	COUNTY-OF-ESSEX-NJ County of Essex NJ
US	396513	COUNTY-OF-FRESNO County of Fresno
US	40795	COUNTY-OF-LAKE County of Lake
US	53527	COUNTY-OF-LOS-ANGELES-SHERIFFS-DEPARTMENT Los Angeles Sheriff's Department
US	36565	COUNTY-OF-MONTGOMERY-PA County of Montgomery
US	398188	COUNTY-OF-PASSAIC County of Passaic
CA	394567	COUNTY-OF-SIMCOE Corporation of the County of Simcoe
US	11212	COUNTY-OF-SONOMA COUNTY OF SONOMA
US	397965	COUNTY-OF-TRAVIS-1 Travis County, Texas
US	394377	COUNTY-OF-TULARE County of Tulare
US	19739	COUNTY-SANBERNARDINO County of San Bernardino
GB	51263	COUNTYBB
US	395652	COUNTYOFBERGEN County of Bergen
US	394516	COUNTYOFNAPAAS County of Napa MIS
US	13990	COUNTYOFORANGE County of Orange
US	23282	COUNTYOFSB Santa Barbara County
US	40863	COURTHOUSE Bossier Parish Police Jury
US	394656	CPA-AS1 Canaveral Port Authority
SG	132253	CPFBOARD-SG 79 Robinson Road
CA	394259	CPPIB-AS Canada Pension Plan Investment Board
BD	63826	CPTU-BD Ministry of Planning, Planning Commission Chatter
US	46341	CPUC-AS-001 California Public Utilities Commission
US	33735	CRANE-DOWNTOWN-BGP CHARLES L CRANE AGENCY Company
KH	137573	CREDITBUREAUCAMBODIACOLTD-AS-AP Credit Bureau Cambodia Co., Ltd
US	46716	CROOK-COUNTY-OREGON Crook County Oregon
US	398665	CSBSO COUNTY OF SAN BERNARDINO
CA	32659	CSCS-ASN Commission scolaire de la Cote-du-Sud
US	4241	CSFTB California State Franchise Tax Board
CA	395899	CSI160 Commission Scolaire des Iles
US	40248	CSL0-AS County of San Luis Obispo
CA	54760	CSPORTNEUF Commission scolaire de Portneuf
US	1226	CTA-42-AS1226 California Department of Technology
US	396990	CTS-MONTICELLO Monticello - Wayne County Telecommunication Board
US	40553	CUYAHOGA-COUNTY Cuyahoga County Information Services center
BR	53239	Companhia de Governanca Eletronica do Salvador
BR	264468	Conselho Nacional de Justica
US	399617	DALLAS-COUNTY-DATA Satellite Center, LLC
US	62476	DANC Development Authority of the North Country
US	22238	DARPA Defense Advanced Research Projects Agency(DARPA)
US	399012	DART-ASN Des Moines Regional Transit Authority (DART)
AU	38474	DAWE-AS-AU DEPARTMENT OF AGRICULTURE WATER AND THE ENVIRONMENT
AU	134584	DBSAPL-AS-AP Diligent Board Services Australia Pty Ltd
US	398381	DC-ASN Dallas, County Of
US	30269	DCB-AS1 Door County Broadband LLC
US	63154	DCCC Delaware County Community College
US	394812	DCE911 Decatur County E911 Board
US	36253	DCIUNET Delaware County Intermediate Unit
US	397406	DCMH-DELTA-01 Delta County Memorial Hospital
US	53357	DCSD Douglas County School District RE.1
US	18838	DCSSGA DeKalb County School System
KR	23599	DDNSKR-KR Korea Internet Security Agency
DE	213238	DE-GOV-BDBOS
DE	213283	DE-GOV-ST
AU	38066	DECC-AS-AP Department of Environment and Climate Change
TH	136781	DEDE-AS-AP Department of Alternative Energy Development and Efficiency
US	40724	DEKALB-COUNTY-GEORGIA-GOVERNMENT DeKalb County, Georgia
US	393687	DELAWARE-RIVER-AND-BAY-AUTHORITY Delaware River and Bay Authority
US	395975	DENTONCOAS-1 Denton County, Texas
BR	22515	DEPARTAMENTO DE POLICIA FEDERAL Latin American and Caribbean IP address Regional Registry
IN	132527	DEPARTMENTOFPOSTS-AS-AP Department of Posts
RU	205060	DEPARTMENT_IT_OF_SMOLENSK_REGION
ID	55656	DEPHUB-AS-ID Ministry of Transportation Republic of Indonesia
US	398033	DEPT-OF-LABOR U.S. Department of Labor - OASAM/DIRM
AU	135880	DEPTCULTUREANDARTS-AS-AP Department of Culture and the Arts
US	18668	DESCHUTES-COUNTY-911 Deschutes 911
AU	9509	DESE-AS-AP Department of Education Skills and Employment
AU	18431	DFAT-PUBLIC-GW-AS Department of Foreign Affairs and Trade
BD	58527	DGHS-GOV-BD Management Information System MIS
IN	137646	DGRPB-AS-IN Department of Governance Reforms
US	46211	DHA Decatur Hospital Authority
US	23458	DHH-AUTHORITY Denver Health and Hospital Authority
US	396972	DHS-39N Department of Homeland Security
US	15147	DHSINETNOC DEPARTMENT OF HOMELAND SECURITY
US	20329	DIAMONDNET Sallisaw Municipal Authority
PH	141196	DICT-AS-AP DEPARTMENT OF INFORMATION AND COMMUNICATION TECHNOLOGY
US	13	DNIC-AS-00013 Headquarters, USAISC
US	22	DNIC-AS-00022 Navy Network Information Center (NNIC)
US	37	DNIC-AS-00037 Navy Network Information Center (NNIC)
US	48	DNIC-AS-00048 Navy Network Information Center (NNIC)
US	51	DNIC-AS-00051 Headquarters, USAISC
US	56	DNIC-AS-00056 DoD Network Information Center
US	83	DNIC-AS-00083 Headquarters, USAISC
US	84	DNIC-AS-00084 Navy Network Information Center (NNIC)
US	89	DNIC-AS-00089 Navy Network Information Center (NNIC)
US	118	DNIC-AS-00118 DoD Network Information Center
US	121	DNIC-AS-00121 DoD Network Information Center
US	138	DNIC-AS-00138 DoD Network Information Center
US	140	DNIC-AS-00140 DoD Network Information Center
US	147	DNIC-AS-00147 DoD Network Information Center
US	149	DNIC-AS-00149 DoD Network Information Center
US	170	DNIC-AS-00170 DoD Network Information Center
US	190	DNIC-AS-00190 Navy Network Information Center (NNIC)
US	213	DNIC-AS-00213 Headquarters, USAISC
US	228	DNIC-AS-00228 DoD Network Information Center
US	252	DNIC-AS-00252 Headquarters, USAISC
US	257	DNIC-AS-00257 Navy Network Information Center (NNIC)
US	273	DNIC-AS-00273 DoD Network Information Center
US	289	DNIC-AS-00289 Headquarters, USAISC
US	300	DNIC-AS-00300 DoD Network Information Center
US	518	DNIC-AS-00518 DoD Network Information Center
US	523	DNIC-AS-00523 Headquarters, USAISC
US	531	DNIC-AS-00531 Headquarters, USAISC
US	571	DNIC-AS-00571 DoD Network Information Center
US	575	DNIC-AS-00575 Headquarters, USAISC
US	580	DNIC-AS-00580 DoD Network Information Center
US	615	DNIC-AS-00615 Headquarters, USAISC
US	668	DNIC-AS-00668 DoD Network Information Center
US	670	DNIC-AS-00670 Headquarters, USAISC
US	671	DNIC-AS-00671 Headquarters, USAISC
US	672	DNIC-AS-00672 Headquarters, USAISC
US	673	DNIC-AS-00673 Headquarters, USAISC
US	687	DNIC-AS-00687 DoD Network Information Center
US	747	DNIC-AS-00747 Headquarters, USAISC
US	748	DNIC-AS-00748 DoD Network Information Center
US	749	DNIC-AS-00749 DoD Network Information Center
US	1208	DNIC-AS-01208 DoD Network Information Center
US	1461	DNIC-AS-01461 Headquarters, USAISC
US	1466	DNIC-AS-01466 Headquarters, USAISC
US	1480	DNIC-AS-01480 Headquarters, USAISC
US	1483	DNIC-AS-01483 Headquarters, USAISC
US	1484	DNIC-AS-01484 Headquarters, USAISC
US	1491	DNIC-AS-01491 Headquarters, USAISC
US	1503	DNIC-AS-01503 Headquarters, USAISC
US	1505	DNIC-AS-01505 Headquarters, USAISC
US	1508	DNIC-AS-01508 Headquarters, USAISC
US	1519	DNIC-AS-01519 Headquarters, USAISC
US	1527	DNIC-AS-01527 Headquarters, USAISC
US	1528	DNIC-AS-01528 Headquarters, USAISC
US	1531	DNIC-AS-01531 Headquarters, USAISC
US	1533	DNIC-AS-01533 Headquarters, USAISC
US	1602	DNIC-AS-01602 Headquarters, USAISC
US	1637	DNIC-AS-01637 Headquarters, USAISC
US	1649	DNIC-AS-01649 Headquarters, USAISC
US	1772	DNIC-AS-01772 Navy Network Information Center (NNIC)
US	1904	DNIC-AS-01904 DoD Network Information Center
US	1908	DNIC-AS-01908 DoD Network Information Center
US	1959	DNIC-AS-01959 DoD Network Information Center
US	2046	DNIC-AS-02046 DoD Network Information Center
US	2577	DNIC-AS-02577 DoD Network Information Center
US	2621	DNIC-AS-02621 DoD Network Information Center
US	2749	DNIC-AS-02749 Navy Network Information Center (NNIC)
US	3470	DNIC-AS-03470 DoD Network Information Center
US	3471	DNIC-AS-03471 DoD Network Information Center
US	3472	DNIC-AS-03472 DoD Network Information Center
US	3474	DNIC-AS-03474 DoD Network Information Center
US	3475	DNIC-AS-03475 Navy Network Information Center (NNIC)
US	3538	DNIC-AS-03538 DoD Network Information Center
US	3541	DNIC-AS-03541 DoD Network Information Center
US	3544	DNIC-AS-03544 DoD Network Information Center
US	3954	DNIC-AS-03954 DoD Network Information Center
US	4010	DNIC-AS-04010 Headquarters, USAISC
US	5052	DNIC-AS-05052 DoD Network Information Center
US	306	DNIC-ASBLK-00306-00371 DoD Network Information Center
US	307	DNIC-ASBLK-00306-00371 DoD Network Information Center
US	308	DNIC-ASBLK-00306-00371 DoD Network Information Center
US	309	DNIC-ASBLK-00306-00371 DoD Network Information Center
US	310	DNIC-ASBLK-00306-00371 DoD Network Information Center
US	311	DNIC-ASBLK-00306-00371 DoD Network Information Center
US	312	DNIC-ASBLK-00306-00371 DoD Network Information Center
US	313	DNIC-ASBLK-00306-00371 DoD Network Information Center
US	316	DNIC-ASBLK-00306-00371 DoD Network Information Center
US	317	DNIC-ASBLK-00306-00371 DoD Network Information Center
US	319	DNIC-ASBLK-00306-00371 DoD Network Information Center
US	320	DNIC-ASBLK-00306-00371 DoD Network Information Center
US	321	DNIC-ASBLK-00306-00371 DoD Network Information Center
US	322	DNIC-ASBLK-00306-00371 DoD Network Information Center
US	323	DNIC-ASBLK-00306-00371 DoD Network Information Center
US	324	DNIC-ASBLK-00306-00371 DoD Network Information Center
US	325	DNIC-ASBLK-00306-00371 DoD Network Information Center
US	326	DNIC-ASBLK-00306-00371 DoD Network Information Center
US	327	DNIC-ASBLK-00306-00371 DoD Network Information Center
US	328	DNIC-ASBLK-00306-00371 DoD Network Information Center
US	329	DNIC-ASBLK-00306-00371 DoD Network Information Center
US	331	DNIC-ASBLK-00306-00371 DoD Network Information Center
US	334	DNIC-ASBLK-00306-00371 DoD Network Information Center
US	335	DNIC-ASBLK-00306-00371 DoD Network Information Center
US	336	DNIC-ASBLK-00306-00371 DoD Network Information Center
US	337	DNIC-ASBLK-00306-00371 DoD Network Information Center
US	338	DNIC-ASBLK-00306-00371 DoD Network Information Center
US	339	DNIC-ASBLK-00306-00371 DoD Network Information Center
US	340	DNIC-ASBLK-00306-00371 DoD Network Information Center
US	341	DNIC-ASBLK-00306-00371 DoD Network Information Center
US	342	DNIC-ASBLK-00306-00371 DoD Network Information Center
US	343	DNIC-ASBLK-00306-00371 DoD Network Information Center
US	344	DNIC-ASBLK-00306-00371 DoD Network Information Center
US	345	DNIC-ASBLK-00306-00371 DoD Network Information Center
US	346	DNIC-ASBLK-00306-00371 DoD Network Information Center
US	347	DNIC-ASBLK-00306-00371 DoD Network Information Center
US	348	DNIC-ASBLK-00306-00371 DoD Network Information Center
US	349	DNIC-ASBLK-00306-00371 DoD Network Information Center
US	350	DNIC-ASBLK-00306-00371 DoD Network Information Center
US	351	DNIC-ASBLK-00306-00371 DoD Network Information Center
US	352	DNIC-ASBLK-00306-00371 DoD Network Information Center
US	353	DNIC-ASBLK-00306-00371 DoD Network Information Center
US	355	DNIC-ASBLK-00306-00371 DoD Network Information Center
US	356	DNIC-ASBLK-00306-00371 DoD Network Information Center
US	357	DNIC-ASBLK-00306-00371 DoD Network Information Center
US	358	DNIC-ASBLK-00306-00371 DoD Network Information Center
US	359	DNIC-ASBLK-00306-00371 DoD Network Information Center
US	360	DNIC-ASBLK-00306-00371 DoD Network Information Center
US	361	DNIC-ASBLK-00306-00371 DoD Network Information Center
US	362	DNIC-ASBLK-00306-00371 DoD Network Information Center
US	364	DNIC-ASBLK-00306-00371 DoD Network Information Center
US	365	DNIC-ASBLK-00306-00371 DoD Network Information Center
US	366	DNIC-ASBLK-00306-00371 DoD Network Information Center
US	367	DNIC-ASBLK-00306-00371 DoD Network Information Center
US	368	DNIC-ASBLK-00306-00371 DoD Network Information Center
US	369	DNIC-ASBLK-00306-00371 DoD Network Information Center
US	370	DNIC-ASBLK-00306-00371 DoD Network Information Center
US	371	DNIC-ASBLK-00306-00371 DoD Network Information Center
