US	397051	1500-MED-ASSOC-DBQ Medical Associates Clinic, P.C.
US	393820	22ND-DAA 22nd District Agricultural Association
US	399143	4CEPA-FASTNET 4-County Electric Power Association
US	20427	AAAE American Association of Airport Executives
US	396210	AAAHC-HQ Accreditation Association for Ambulatory Health Care, Inc.
US	22671	AAAS American Association for the Advancement of Science
US	393847	AAMC-AS1 Association of American Medical Colleges
US	18929	AAMVA THE AMERICAN ASSOCIATION OF MOTOR VEHICLE ADMINISTRATORS
US	395892	AANA-1 American Association of Nurse Anesthetists
US	10944	ABAG-10944 Association of Bay Area Governments
US	36607	ACM Association for Computing Machinery, Inc
US	25857	ACS-ASN American Chemical Society
US	21645	ADA-CHICAGO American Dental Association
US	400234	AFMC-1 Arkansas Foundation for Medical Care, Inc.
JP	23804	AIN-NET Nonprofit Organization Kitaura Hana Net
US	397824	ALASKA-PERMANENT-FUND-CORPORATION-AS-01 Alaska Permanent Fund Corporation, an instrumentality of the State of Alaska
US	30112	ALTA-1828 AMERICAN LAND TITLE ASSOCIATION
US	33540	ALZHEI-ASN Alzheimers Assoc.
US	20048	AMA-AS-0001 American Medical Association
US	35943	AMC Association Management Center, Inc.
US	27003	AMERICAN-BANKERS-ASSOCIATION American Bankers Association
US	394063	AMHERST-H-WILDER-FOUNDATION Amherst H. Wilder Foundation
US	36305	AMTA-AS1 The Albany Mutual Telephone Association
US	397977	ANA-218-LB American Nurses Association, Inc
AU	38465	ANGLICANCHURCH-AS-AU ANGLICAN CHURCH COMMUNITY
US	54316	AP-FOUNDATION AP GP, LLC
KR	9270	APAN-KR-AS National Infomation Society Agency
US	32512	APHA-DC-1 AMERICAN PUBLIC HEALTH ASSOCIATION
US	394348	ARA-MOLINE American Rental Association
AU	136142	ARC-AS-AP AUSTRALIAN RED CROSS SOCIETY
US	36350	AS-DEVEREUX The Devereux Foundation
US	13931	AS-MH001 MASONIC CHARITY FOUNDATION OF NEW JERSEY
US	396135	AS-WOODMENLIFE-1 Woodmen of the World Life Insurance Society
US	395601	ASHP-HQ AMERICAN SOCIETY OF HEALTH SYSTEM PHARMACISTS
US	40451	ASN-BOP Board of Pensions of the Evangelical Lutheran Church in America
US	32974	ASN-GHC Kaiser Foundation Health Plan, Inc.
US	10946	ASN-NTF Network Time Foundation, Inc.
US	4576	ASN1 Michael & Susan Dell Foundation
JP	131949	ASO-NET General Incorporated Foundation Aso Telework Center
US	11632	ASPS-HQ-ASN01 American Society of Plastic Surgeons
BR	267302	ASSOC. USU. SIST. TELEC. AFINS DO CENTRO EMPRES SP
US	62918	ASTM-INTL American Society for Testing and Materials - ASTM
US	16678	AUSRAD Austin Radiological Association
US	393800	AWMF The Andrew W. Mellon Foundation
BR	262829	Assoc do Inst Nac de Matematica Pura e Aplicada
SE	197323	B-AND-P-FUND-SERVICE-AB
US	33730	BAC-AS-LIB-EXTERNAL Bank of America, National Association
US	10998	BAC-MLAMRS Bank of America, National Association
US	10959	BAC-NPC Bank of America, National Association
US	10794	BANKAMERICA Bank of America, National Association
CA	40598	BCWARN British Columbia Frequency Modulation Communications Association
US	14147	BFSFCU-ASN Bank-Fund Staff Federal Credit Union
EU	19178	BGC-INTERNATIONAL BGC International One Churchil Place London, E14 5RD GB RIPE Network Coordination Centre
US	22620	BOARDPENSIONS-PRESBYTERIAN The Board of Pensions of the Presbyterian Church (USA)
US	19886	BOFABROKERDEALERSVCS Bank of America, National Association
US	33470	CANBYTELEPHONEASSOCIATION Canby Telephone Association
US	11126	CARLE-ASN Carle Clinic Association
US	394763	CCCERA-AS Contra Costa County Employees Retirement Association
US	399962	CCECA-1 Cherokee County Electric Cooperative Association
US	22093	CCF-NETWORK Cleveland Clinic Foundation
AU	139665	CCIL-AS-AP Catholic Church Insurance Limited
US	63117	CDI Churchill Downs Incorporated
US	393276	CEA Chugach Electric Association, Inc.
US	53411	CENTRAL-SERVICE-ASSOCIATION Central Service Association
IN	133992	CEOCHIPS-AS Chhattisgarh Infotech and Biotech Promotion Society
US	394251	CFF Cystic Fibrosis Foundation
US	54015	CHI-INT-PROD-MKT-NET Chicago International Produce Market Condominium association
US	10583	CHIME Connecticut Hospital Assoc.
NZ	45140	CHRIST-COLLEGE-NZ-AS-AP Christ College Christchurch ASN
US	40391	CHSINC CHS COOPERATIVES FOUNDATION
US	26980	CHURCH-DWIGHT Church & Dwight Company, Inc.
US	396257	CHURCH-OF-THE-NAZARENE-INC General Board of The Church of The Nazarene
US	4902	CI-CCASN CONSERVATION INTERNATIONAL FOUNDATION
US	13558	CMIC-HO Church Mutual Insurance Company
US	399201	CMPS-AS Compass Christian Church
US	394062	COLLEGE-FOUNDATION-INC College Foundation, Inc.
US	33461	COMMUNITY-FOUNDATION-OF-NORTHWEST-INDIANA COMMUNITY FOUNDATION OF NW INDIANA
IN	141515	CPF2013-AS Cyber Peace Foundation
NZ	45138	CPIT-NZ-AS-AP Christchurch Polytechnic Institute
KR	23568	CRA-AS-KR Cycle Racing Association
US	7914	CSI Church of Scientology International
AU	58921	CSL-AS-AP Capricorn Society Limited
US	7317	CSPS-AS The First Church of Christ, Scientist
US	394343	CSSNY Community Service Society of New York
US	393285	CTPF203 Chicago Teachers Pension Fund
HN	263740	Corporacion Laceibanetsociety
GB	210777	DARYLL-SWER This AS is used for non-profit research and experiments.
US	30141	DEMOCRATIC-NATIONAL-COMMITTEE Democratic National Committee
US	30291	DFMC Delmarva Foundation for Medical Care, Inc.
US	394499	DIMENSIONAL Dimensional Fund Advisors
US	63107	ECIN Bijou Telephone Co-op Association, Inc.
CA	33300	EDAASN Electricity Distributors Association
PA	265654	ENX FUND INC
IN	134251	EPFONDC-AS-IN EMPLOYEES PROVIDENT FUND ORGANISATION
CA	30648	ERACA-AS Electronic Recycling Association
US	394119	EXPERIMENTAL-COMPUTING-FACILITY eXperimental Computing Facility Foundation
US	36596	FACC Florida Association of Court Clerks, Inc.
NZ	132083	FCSL-AS-AP FOUNDATION CLOUD SERVICES LIMITED
US	25823	FLAG-ORG CHURCH OF SCIENTOLOGY FLAG SERVICE ORGANIZATION, INC.
US	53498	FORD-FOUNDATION Ford Foundation
US	54974	FOUNDATIONSOFTWARE Foundation Software Inc
US	33063	FREDCCHURCH Fred C. Church, Inc.
US	22989	FREEASINFREEDOM Free Software Foundation, Inc.
US	46619	FRG-RAD Foundation Radiology Group
PK	45939	FSL-AS-AP Foundation Securities Private Limited
RU	34851	FSS Fund of Social Insurance of Russian Federation
US	399190	FSTRF14226 Frontier Science and Technology Research Foundation, Inc.
BR	262441	Fund. Vale do Taquari de Educ. e Desenvolv. Social
BR	52950	Fund. de Apoio a Pesq. C&T do Est. de SC - FAPESC
US	15238	GATESFOUNDATION Bill & Melinda Gates Foundation
US	394238	GCFA-ASN01 GENERAL COUNCIL ON FINANCE AND ADMINISTRATION OF THE UNITED METHODIST CHURCH
US	397119	GEN2-ASN-BGP Gen II Fund Services, LLC
US	33397	GENSOCIETYUTAH Genealogical Society of Utah
US	22559	GNF-ORG Genomics Institute of the Novartis Research Foundation
US	55100	GTCNA The Glenmede Trust Company National Association
CH	210752	Global Legal Entity Identifier Foundation
US	26093	HAR Houston Association of Realtors
US	18562	HAWTHORNE Hawthorne Residents Cooperative Association Inc
US	398895	HBFF-ASN-01 Hazelden Betty Ford Foundation
US	784	HJFNET-AS Henry M. Jackson Foundation for The Advancement of Military Medicine
US	23204	HMSA-ASNID Hawaii Medical Service Association
CA	399786	HOPPTF-AS Healthcare of Ontario Pension Plan Trust Fund
HU	6711	HUNGARNET-SZEGED Szeged University Association and
CA	20221	IATA International Air Transport Association
ID	137372	IDNIC-ASEAN-AS-ID Association Of Southeast Asian Nation
IE	200947	IE-ROYALDUBLINSOCIETY-20141223
IN	23726	IIFON-AS-AP India Internet Foundation
US	11309	IMF International Monetary Fund
US	11296	INDEPENDENT-HEALTH Independent Health Association, Inc.
IE	2128	INEX Internet Neutral Exchange Association Company Limited By Guarantee
US	393861	INOVA-PRIMARYASN-01 Inova Health System Foundation
US	33010	INTERCHURCH The Interchurch Center
US	54384	IREA-ASN The Intermountain Rural Electric Association
SG	141384	ISAL-AS-AP Internet Society Asia Limited
FR	211484	IT-JUNIOR Association IT-JUNIOR
US	20238	ITC-LGCA-ORG Lake Geauga Computer Association
JP	2523	ITRC-NET JSPS 163rd Committee on Internet Technology Asia Pacific Network Information Centre
AU	10025	IUSN-AS-AP The IUSN Foundation
NZ	45172	JADE-NZ-AS-AP Jade Software Corporation Christchurch ASN
US	54496	JFBC-AS Johnson Ferry Baptist Church, Inc.
JP	17944	JWA Japan Weather Association
US	3379	KAISER-NCAL Kaiser Foundation Health Plan, Inc.
KR	17601	KCGF-AS-KR KOREA CREDIT GUARANTEE FUND
US	393554	KELLERAMERICAS Keller Foundations, LLC
US	11286	KEYBANK KeyBank National Association
KR	38433	KFAC-AS-KR Korea Fund Administration Compliance
KR	45397	KFPP-AS-KR KOREA FOUNDATION FOR THE PROMOTION OF PRIVATE SCHOOL
KR	10187	KISDI-AS-KR Korea Information Society Developement Institute
KR	45988	KODIT-AS-KR KOREA CREDIT GUARANTEE FUND
KR	9841	KOFIANET-AS-KR Korea Financial Investment Association
KR	17576	KOSEF-AS-KR National Research Foundation of Korea
KR	9494	KOSINET-AS National Infomation Society Agency
KR	9974	KRA-AS-KR Korea Racing Association
KR	17591	KRFNET-AS-KR National Research Foundation of Korea
US	394399	LACA-ASN Licking Area Computer Association
UY	61455	LACTLD - LATIN AMERICAN AND CARIBBEAN TLD ASSOCIATION
US	32936	LAKEWOODCHURCH Lakewood Church
AU	140672	LCA-AS-AP LUTHERAN CHURCH OF AUSTRALIA INC
US	395245	LCWA La Canada Wireless Association
US	19648	LDSCHURCH1 Corporation of the Presiding Bishop of the Church of Jesus Christ of Latter-Day Saints
US	40812	LEECA Lake Erie Educational Computer Association
US	54264	LIFECHURCH LIFE COVENANT CHURCH, INC
US	32948	LLS-HO-AS LEUKEMIA & LYMPHOMA SOCIETY
US	26898	LNOCA-ORG Lakeshore Northeast Ohio Computer Association (LNOCA)
CA	394520	LSUCNET2 The Law Society of Upper Canada
NG	328503	Living-Faith-Church-WorldWide-AS
US	393830	MAINE-MUNICIPAL-ASSOCIATION Maine Municipal Association
US	10936	MARNELL-CORRAO-ASSOC-MCC1 Marnell Corrao Assoc.
US	7973	MAYO Mayo Foundation for Medical Education and Research
MM	141236	MCDC-AS-AP Mandalay City Development Committee
US	397453	MEEKER-01 Meeker Cooperative Light & Power Association
US	63102	MESSA-AS Michigan Education Special Services Association
US	12247	META-SOLUTIONS Tri-Rivers Educational Computer Association
US	398448	MFSTNET-AS THE GENTRY FUND LLC
US	394702	MGE MADISON GAS AND ELECTRIC FOUNDATION, INC.
US	395078	MHALINK-01 Massachusetts Health & Hospital Association, Inc.
US	394728	MILES Miles Cooperative Telephone Association, Inc.
US	399384	MISSION-HILLS-CHURCH Mission Hills Church
US	399066	MMS-PUBLIC-AS01 Massachusetts Medical Society
FR	31576	MOGEIX Association Gixe
US	36033	MOON-AS Moon Capital Master Fund Ltd.
US	11090	MTAONLINE-AS Matanuska Telephone Association, Inc.
US	63214	MUSL-RANGE1 Multi-State Lottery Association
US	22320	MVECA-AS Miami Valley Educational Computer Association
US	19352	NACHA-HQ NACHA The Electronic Payments Association
US	394053	NAICWEB National Association of Insurance Commissioners
US	395402	NAR-19 National Association of Realtors
US	6462	NATGEOGRAPH-AS National Geographic Society
US	26043	NATL-EDU National Education Association
US	394747	NCAA-NATIONAL-OFFICE National Collegiate Athletic Association (NCAA)
US	393664	NCQA National Committee for Quality Assurance
US	26868	NCTA-WASHINGTONDC NCTA - The Internet & Television Association
US	398743	NEMOURS The Nemours Foundation
US	36242	NFLLC-EQUINIX-ED Network Foundations LLC
US	33428	NHS-39AS The New-York Historical Society
IN	139864	NIAIFL-AS-AP National Investment And Infrastructure Fund Limited
FR	2484	NIC-FR-DNS-ANYCAST-AFNIC AFNIC Association Francaise pour le Nommage Internet en Cooperation RIPE Network Coordination Centre
FR	2486	NIC-FR-DNS-UNICAST-PARIS2 AFNIC Association Francaise pour le Nommage Internet en Cooperation RIPE Network Coordination Centre
FR	2485	NIC-FR-SITES-SQY-TH3 AFNIC Association Francaise pour le Nommage Internet en Cooperation RIPE Network Coordination Centre
US	25810	NLHA-INET-AS The New London Hospital Association, Inc
US	397836	NORTHCENTRAL-MS-OB-01 Northcentral Electric Power Association
US	17209	NORTHWEST-EVALUATION-ASSOCIATION NORTHWEST EVALUATION ASSOCIATION
US	396218	NRA National Rifle Association of America
US	102	NSF-HQ-AS National Science Foundation
PG	146949	NSFL-AS-AP National Superannuation Fund Ltd.
CA	29939	NSRFC-AS Nova Scotia Research Foundation Corporation
US	62724	NWOCA-AS Northwest Ohio Computer Association
US	53585	NYSIF The State Insurance Fund
TZ	327912	National-Health-Insurance-Fund
GB	8698	Nationwide Building Society
US	63103	OCF-AS Ochsner Clinic Foundation
US	30541	OSPRAIE-NYC Ospraie Fund
US	399728	P-FOUNDATION P Foundation
EU	2147	PA-AS The Press Association Ltd RIPE Network Coordination Centre
US	398242	PCEPA Prentiss County Electric Power Association
PH	138147	PCTA-AS-AP Philippine Cable Television Association, Inc.
US	33581	PEOPLESBANK-NA Peoples Bank, National Association
US	22638	PHILORCH-ASN The Philadelphia Orchestra Association
US	10821	PIONEERINTERNET The Pioneer Telephone Association, Inc.
US	22817	PNC PNC Bank, National Association
KR	9458	POBA-AS-KR Public Officials Benefit Association
US	32670	PPAR-COS Pikes Peak Association of REALTORS INC
US	54236	PPPA-ASN Pacific Press Publishing Association, Inc
US	40148	PRINCE-GEORGES-INTERGOVERNMENTAL-NETWORK PRINCE GEORGES INTERGOVERNMENTAL NETWORK COMMUNITY COORDINATING COMMITTEE
US	30649	PRINCIPALS National Association of Secondary School Principals
US	17380	PROJ-MUT-TEL Project Mutual Telephone Cooperative Association, Inc.
US	26550	PROVIDENT-FUNDING-ASSOC Provident Funding
QA	29384	QATAR-FOUNDATION
BD	134403	QUANTUMFOUNDATION-AS-AP Quantum Foundation
US	13416	R-GREENBERG-ASSOC R/Greenberg Associates
AU	138363	RASON-AS-AP Royal Agricultural Society of NSW
US	395858	RAVINIA RAVINIA FESTIVAL ASSOCIATION
CA	397894	REAL-ASN-01 Regina Exhibition Association Ltd
TH	133880	REDCROSS-AS-AP The Thai Red Cross Society
US	12016	RETIREMENT-HOUSING-FOUNDATION Retirement Housing Foundation
US	15050	RF-AS1 The Rockefeller Foundation
US	26654	RFA-IDC Richard Fleischman & Assoc., Inc.
US	397604	RFSUNY The Research Foundation for the State University of New York.
US	11470	RSNA-ASN Radiological Society of North America
US	26764	RWJF-AS The Robert Wood Johnson Foundation
EU	250	SACREDCHAO-AS AS250.net Foundation RIPE Network Coordination Centre
AU	133102	SAHMSC-AS-AP Sydney Anglican Home Mission Society Council
US	29921	SAIFCO State Accident Insurance Fund Corporation
IN	132547	SAJAGPRAHARI-AS Sajag Prahari Foundation
AU	136152	SANITARIUM-AS-AP Australian Health & Nutrition Association
US	55092	SANSUM-CLINIC Sansum Santa Barbara Medical Foundation Clinic
US	396072	SCAG Southern California Association of Governments
NZ	138360	SCMCS-AS-AP Southern Cross Medical Care Society
US	36794	SCOCA South Central Ohio Computer Association
US	26417	SCOPIA-NY Scopia Fund Management, LLC
US	30341	SCTA-ASN South Central Telephone Association
AU	136924	SDASPD-AS-AP SEVENTH-DAY ADVENTIST CHURCH SPD LIMITED
BR	262513	SERMA ASSOC DOS USUARIOS DE QUIP DE PROCESS DE DAD
KR	10191	SGMF-AS-KR SEEGENE MEDICAL FOUNDATION
US	25770	SHRM Society for Human Resource Management
US	53823	SMTA Scio Mutual Telephone Association
IN	139516	SNFIT-AS-IN Shiv Nadar Foundation
US	27200	SOCIETY-OF-AUTOMOTIVE-ENGINEERS Society of Automotive Engineers
US	25938	SOROS-FUND-MAN Soros Fund Management LLC
US	22991	SPE-199-26-202 SOCIETY OF PETROLEUM ENGINEERS (SPE), INC.
US	36203	STELLAR-ASSOCIATION Stellar Association, LLC
US	36374	STELLAR-ASSOCIATION Stellar Association, LLC
US	62553	STERLING Sterling Fund Management, LLC
BE	48075	SWIFTASN Society For Worldwide Interbank Financial Telecommunication SCRL
US	33167	SWOCA-TWASSIGNED Southwest Ohio Computer Association
US	29941	TCCSA Tri-County Computer Services Association
US	64279	TFSLAOC Third Federal Savings and Loan Association of Cleveland
TH	55932	THAIBMA-AS-AP The Thai Bond Market Association
US	32005	THE-CHURCH-PENSION-GROUP CHURCH PENSION GROUP SERVICES CORPORATION
US	22771	THE-COMMON-FUND The Common Fund
US	32403	THE-HERITAGE-FOUNDATION The Heritage Foundation
US	40404	TMH-WV-NET HERBERT J. THOMAS MEMORIAL HOSPITAL ASSOCIATION
TH	137856	TNICF-AS-AP Thai Network Information Center Foundation
AU	142038	TOTRCCFTDOL-AS-AP Trustees of the Roman Catholic Church for the Diocese of Lismore
US	33003	TRI-COUNTY-CORE The Tri-County Telephone Association, Inc.
JP	55373	TRI-KOBE-NET Foundation for Biomedical Research and Innovation
US	11250	TRI-STATE-G-AND-T Tri-State Generation and Transmission Association Inc.
US	32171	TRIAN-FUND-MANAGEMENT-LP Trian Fund Management L.P.
AU	140086	TUCIAPT-AS-AP THE UNITING CHURCH IN AUSTRALIA SYNOD OF VICTORIA AND TASMANIA
IN	135404	TWTBATSOI-AS-AP THE WATCH TOWER BIBLE AND TRACT SOCIETY OF INDIA
US	15007	TZUCHI Buddhist Tzu Chi Foundation
US	22723	UN United Nations
BR	264125	UN TELECOMUNICACOES LTDA ME
TH	45229	UN-ESCAP-AS-AP United Nation - Property Management Sub-unit, Thailand
TH	45860	UN-TH-AS-AP United Nation
UA	24703	UN-UKRAINE-AS Kiev, Ukraine
IT	28977	UN-UNLB
AU	58509	UNITINGCHURCH-AU The Uniting Church in Australia, Property Trust Q
US	4497	UPSTEL-NET Upsala Co-operative Telephone Association
US	63238	UPTEL Upchurch Telecom & Data, Inc.
US	30174	UTA United Telephone Association, Inc.
RU	43785	UVZ-AS FSUE Production Association URALVAGONZAVOD named after Felix E. Dzerzhinsky
US	394972	VALLEY-COMMUNICATIONS Valley Electric Association
US	2559	VISANET VISA INTERNATIONAL SERVICE ASSOCIATION
US	395814	WABASHVALLEYPOWERASSOC Wabash Valley Power Association Inc.
AU	131088	WAIA-4BYTE-AS-AP Western Australian Internet Association
AU	10084	WAIA-TRANSIT-AP Western Australian Internet Association
JP	55891	WBTSJP-AS WATCH TOWER BIBLE AND TRACT SOCIETY
US	40335	WBTSNY-AS Watchtower Bible and Tract Society of New York, Inc.
US	30416	WCS Wildlife Conservation Society
US	20466	WGBH-EDUCATIONAL-FOUNDATION WGBH Educational Foundation
US	397697	WHE-ASN-01 Wright-Hennepin Cooperative Electric Association
US	398164	WHITEFISHCU-CO WHITEFISH CREDIT UNION ASSOCIATION
US	11698	WIATEL WESTERN IOWA TELEPHONE ASSOCIATION (A COOPERATIVE)
US	14907	WIKIMEDIA Wikimedia Foundation Inc.
US	11820	WIKIMEDIA-FOUNDATION Wikimedia Foundation, Inc.
US	46892	WINNE-IPV4-1 Winnebago Cooperative Telecom Association
TW	140958	WTBATSOPTB-AS-AP Watch Tower Bible and Tract Society of Pennsylvania, Taiwan Branch
PH	140734	WTBATSOTP-AS-AP Watch Tower Bible and Tract Society of the Philippines
CA	54235	WTBTSC-AS Watch Tower Bible and Tract Society of Canada
KR	9454	WTKR-AS-KR Watch Tower Bible and Tract Society of Korea
US	23361	WVUF West Virginia University Foundation, Inc.
US	18824	WWW-THESEAM Plains Cotton Cooperative Association
KR	9945	YFGC-AS-KR yoido full gaspel church
US	10444	ZB NATIONAL ASSOCIATION ZB, National Association
